{
  "model": {
    "model_id": "bounded-stochastic-bandit-unknown-horizon",
    "research_question": "Under an unknown evaluation horizon, can a nonanticipating bandit policy attain the registered distribution-free target rate?",
    "observation_model": "Independent rewards supported on the unit interval with selected-arm feedback.",
    "loss": "Worst-case expected cumulative pseudo-regret through each evaluation horizon."
  },
  "target": {
    "target_id": "unknown-horizon-square-root-rate",
    "objective": "Match the square-root order in arms and horizon without a logarithmic factor while preserving unknown-horizon operation.",
    "required_rate_signature": {
      "polynomial_exponents": {
        "arms": "1/2",
        "horizon": "1/2"
      },
      "log_exponents": {}
    }
  },
  "assumptions": {
    "arms_known": true,
    "feedback": "selected_arm_reward_only",
    "horizon_knowledge": "unknown",
    "reward_process": "iid_within_each_arm",
    "reward_support": "unit_interval"
  },
  "verifier_suite": [
    {
      "verifier_id": "declared-assumption-interface",
      "type": "assumption_exact_match",
      "semantic_scope": "Checks exact equality of declared candidate and target assumption fields.",
      "limitation": "Does not establish that an algorithm or cited theorem truly satisfies those declarations."
    },
    {
      "verifier_id": "declared-rate-signature",
      "type": "rate_signature_exact_match",
      "semantic_scope": "Checks exact equality of registered polynomial and logarithmic rate signatures.",
      "limitation": "Does not prove a regret bound, constants, uniformity, or applicability of a source theorem."
    }
  ],
  "human_judgment_boundary": {
    "ai_may_propose": [
      "solution candidates under the registered specification",
      "versioned model or verifier revisions with explicit costs",
      "questions that expose a possible mismatch in problem identity"
    ],
    "human_must_decide": [
      "whether any model or verifier revision creates a new branch",
      "whether a control-compatible candidate deserves semantic review",
      "whether scientific evidence supports a theorem-level conclusion"
    ],
    "scientific_claim_rule": "A deterministic control pass is not scientific evidence and cannot establish a theorem without an independent semantic verifier or explicit human review of the evidence."
  },
  "version": "1.0.0"
}
